{
 "classes": {
  "NXaberration": {
   "category": "base",
   "extends": "NXobject",
   "specialisations": 0,
   "status": "base"
  },
  "NXactivity": {
   "category": "base",
   "extends": "NXobject",
   "specialisations": 0,
   "status": "base"
  },
  "NXactuator": {
   "category": "base",
   "extends": "NXcomponent",
   "specialisations": 0,
   "status": "base"
  },
  "NXafm": {
   "category": "application",
   "describes": "NXroot",
   "extends": "NXspm",
   "specialisations": 8,
   "status": "contributed"
  },
  "NXamplifier": {
   "category": "base",
   "extends": "NXcomponent",
   "specialisations": 0,
   "status": "contributed"
  },
  "NXaperture": {
   "category": "base",
   "extends": "NXcomponent",
   "specialisations": 0,
   "status": "base"
  },
  "NXapm": {
   "category": "application",
   "describes": "NXroot",
   "specialisations": 99,
   "status": "application"
  },
  "NXapm_charge_state_analysis": {
   "category": "base",
   "extends": "NXprocess",
   "specialisations": 1,
   "status": "base"
  },
  "NXapm_compositionspace_config": {
   "category": "application",
   "describes": "NXroot",
   "specialisations": 9,
   "status": "contributed"
  },
  "NXapm_compositionspace_results": {
   "category": "application",
   "describes": "NXroot",
   "specialisations": 22,
   "status": "contributed"
  },
  "NXapm_event_data": {
   "category": "base",
   "extends": "NXobject",
   "specialisations": 0,
   "status": "base"
  },
  "NXapm_instrument": {
   "category": "base",
   "extends": "NXinstrument",
   "specialisations": 11,
   "status": "base"
  },
  "NXapm_measurement": {
   "category": "base",
   "extends": "NXobject",
   "specialisations": 0,
   "status": "base"
  },
  "NXapm_paraprobe_clusterer_config": {
   "category": "application",
   "describes": "NXroot",
   "extends": "NXapm_paraprobe_tool_config",
   "specialisations": 8,
   "status": "contributed"
  },
  "NXapm_paraprobe_clusterer_results": {
   "category": "application",
   "describes": "NXroot",
   "extends": "NXapm_paraprobe_tool_results",
   "specialisations": 4,
   "status": "contributed"
  },
  "NXapm_paraprobe_distancer_config": {
   "category": "application",
   "describes": "NXroot",
   "extends": "NXapm_paraprobe_tool_config",
   "specialisations": 4,
   "status": "contributed"
  },
  "NXapm_paraprobe_distancer_results": {
   "category": "application",
   "describes": "NXroot",
   "extends": "NXapm_paraprobe_tool_results",
   "specialisations": 4,
   "status": "contributed"
  },
  "NXapm_paraprobe_intersector_config": {
   "category": "application",
   "describes": "NXroot",
   "extends": "NXapm_paraprobe_tool_config",
   "specialisations": 6,
   "status": "contributed"
  },
  "NXapm_paraprobe_intersector_results": {
   "category": "application",
   "describes": "NXroot",
   "extends": "NXapm_paraprobe_tool_results",
   "specialisations": 3,
   "status": "contributed"
  },
  "NXapm_paraprobe_nanochem_config": {
   "category": "application",
   "describes": "NXroot",
   "extends": "NXapm_paraprobe_tool_config",
   "specialisations": 19,
   "status": "contributed"
  },
  "NXapm_paraprobe_nanochem_results": {
   "category": "application",
   "describes": "NXroot",
   "extends": "NXapm_paraprobe_tool_results",
   "specialisations": 29,
   "status": "contributed"
  },
  "NXapm_paraprobe_ranger_config": {
   "category": "application",
   "describes": "NXroot",
   "extends": "NXapm_paraprobe_tool_config",
   "specialisations": 1,
   "status": "contributed"
  },
  "NXapm_paraprobe_ranger_results": {
   "category": "application",
   "describes": "NXroot",
   "extends": "NXapm_paraprobe_tool_results",
   "specialisations": 2,
   "status": "contributed"
  },
  "NXapm_paraprobe_selector_config": {
   "category": "application",
   "describes": "NXroot",
   "extends": "NXapm_paraprobe_tool_config",
   "specialisations": 1,
   "status": "contributed"
  },
  "NXapm_paraprobe_selector_results": {
   "category": "application",
   "describes": "NXroot",
   "extends": "NXapm_paraprobe_tool_results",
   "specialisations": 1,
   "status": "contributed"
  },
  "NXapm_paraprobe_spatstat_config": {
   "category": "application",
   "describes": "NXroot",
   "extends": "NXapm_paraprobe_tool_config",
   "specialisations": 8,
   "status": "contributed"
  },
  "NXapm_paraprobe_spatstat_results": {
   "category": "application",
   "describes": "NXroot",
   "extends": "NXapm_paraprobe_tool_results",
   "specialisations": 4,
   "status": "contributed"
  },
  "NXapm_paraprobe_surfacer_config": {
   "category": "application",
   "describes": "NXroot",
   "extends": "NXapm_paraprobe_tool_config",
   "specialisations": 3,
   "status": "contributed"
  },
  "NXapm_paraprobe_surfacer_results": {
   "category": "application",
   "describes": "NXroot",
   "extends": "NXapm_paraprobe_tool_results",
   "specialisations": 8,
   "status": "contributed"
  },
  "NXapm_paraprobe_tessellator_config": {
   "category": "application",
   "describes": "NXroot",
   "extends": "NXapm_paraprobe_tool_config",
   "specialisations": 3,
   "status": "contributed"
  },
  "NXapm_paraprobe_tessellator_results": {
   "category": "application",
   "describes": "NXroot",
   "extends": "NXapm_paraprobe_tool_results",
   "specialisations": 12,
   "status": "contributed"
  },
  "NXapm_paraprobe_tool_common": {
   "category": "base",
   "extends": "NXobject",
   "specialisations": 1,
   "status": "contributed"
  },
  "NXapm_paraprobe_tool_config": {
   "category": "application",
   "describes": "NXroot",
   "specialisations": 16,
   "status": "contributed"
  },
  "NXapm_paraprobe_tool_parameters": {
   "category": "base",
   "extends": "NXparameters",
   "specialisations": 3,
   "status": "contributed"
  },
  "NXapm_paraprobe_tool_process": {
   "category": "base",
   "extends": "NXprocess",
   "specialisations": 1,
   "status": "contributed"
  },
  "NXapm_paraprobe_tool_results": {
   "category": "application",
   "describes": "NXroot",
   "specialisations": 9,
   "status": "contributed"
  },
  "NXapm_ranging": {
   "category": "base",
   "extends": "NXprocess",
   "specialisations": 4,
   "status": "base"
  },
  "NXapm_reconstruction": {
   "category": "base",
   "extends": "NXprocess",
   "specialisations": 3,
   "status": "base"
  },
  "NXapm_simulation": {
   "category": "base",
   "extends": "NXobject",
   "specialisations": 0,
   "status": "base"
  },
  "NXarchive": {
   "category": "application",
   "describes": "NXroot",
   "specialisations": 5,
   "status": "application"
  },
  "NXarpes": {
   "category": "application",
   "describes": "NXroot",
   "specialisations": 6,
   "status": "application"
  },
  "NXatom": {
   "category": "base",
   "extends": "NXobject",
   "specialisations": 0,
   "status": "base"
  },
  "NXattenuator": {
   "category": "base",
   "extends": "NXcomponent",
   "specialisations": 0,
   "status": "base"
  },
  "NXazint1d": {
   "category": "application",
   "describes": "NXroot",
   "specialisations": 7,
   "status": "application"
  },
  "NXazint2d": {
   "category": "application",
   "describes": "NXroot",
   "specialisations": 7,
   "status": "application"
  },
  "NXbeam": {
   "category": "base",
   "extends": "NXobject",
   "specialisations": 1,
   "status": "base"
  },
  "NXbeam_splitter": {
   "category": "base",
   "extends": "NXcomponent",
   "specialisations": 3,
   "status": "contributed"
  },
  "NXbeam_stop": {
   "category": "base",
   "extends": "NXcomponent",
   "specialisations": 0,
   "status": "base"
  },
  "NXbeam_transfer_matrix_table": {
   "category": "base",
   "extends": "NXobject",
   "specialisations": 0,
   "status": "base"
  },
  "NXbending_magnet": {
   "category": "base",
   "extends": "NXcomponent",
   "specialisations": 0,
   "status": "base"
  },
  "NXcalibration": {
   "category": "base",
   "extends": "NXprocess",
   "specialisations": 2,
   "status": "base"
  },
  "NXcanSAS": {
   "category": "application",
   "describes": "NXroot",
   "specialisations": 12,
   "status": "application"
  },
  "NXcapillary": {
   "category": "base",
   "extends": "NXcomponent",
   "specialisations": 0,
   "status": "base"
  },
  "NXcg_alpha_complex": {
   "category": "base",
   "extends": "NXcg_primitive",
   "specialisations": 0,
   "status": "base"
  },
  "NXcg_cylinder": {
   "category": "base",
   "extends": "NXcg_primitive",
   "specialisations": 0,
   "status": "base"
  },
  "NXcg_ellipsoid": {
   "category": "base",
   "extends": "NXcg_primitive",
   "specialisations": 0,
   "status": "base"
  },
  "NXcg_face_list_data_structure": {
   "category": "base",
   "extends": "NXcg_primitive",
   "specialisations": 0,
   "status": "base"
  },
  "NXcg_grid": {
   "category": "base",
   "extends": "NXcg_primitive",
   "specialisations": 0,
   "status": "base"
  },
  "NXcg_half_edge_data_structure": {
   "category": "base",
   "extends": "NXcg_primitive",
   "specialisations": 0,
   "status": "base"
  },
  "NXcg_hexahedron": {
   "category": "base",
   "extends": "NXcg_primitive",
   "specialisations": 0,
   "status": "base"
  },
  "NXcg_parallelogram": {
   "category": "base",
   "extends": "NXcg_primitive",
   "specialisations": 0,
   "status": "base"
  },
  "NXcg_point": {
   "category": "base",
   "extends": "NXcg_primitive",
   "specialisations": 0,
   "status": "base"
  },
  "NXcg_polygon": {
   "category": "base",
   "extends": "NXcg_primitive",
   "specialisations": 0,
   "status": "base"
  },
  "NXcg_polyhedron": {
   "category": "base",
   "extends": "NXcg_primitive",
   "specialisations": 0,
   "status": "base"
  },
  "NXcg_polyline": {
   "category": "base",
   "extends": "NXcg_primitive",
   "specialisations": 0,
   "status": "base"
  },
  "NXcg_primitive": {
   "category": "base",
   "extends": "NXobject",
   "specialisations": 0,
   "status": "base"
  },
  "NXcg_roi": {
   "category": "base",
   "extends": "NXobject",
   "specialisations": 0,
   "status": "base"
  },
  "NXcg_tetrahedron": {
   "category": "base",